{
  "base_commit": null,
  "blocking_severity": "high",
  "branch": "",
  "changed_features": [],
  "commit": "",
  "database_assertions": [],
  "environment": "qa",
  "options": {
    "capture_logs": true,
    "capture_video": false,
    "reset_fixtures": false
  },
  "platforms": [
    "android"
  ],
  "repository": "BuffagoApp",
  "request_id": "serrano-a7224d04-439d-402e-ab1f-edf0ea421363",
  "requested_by": "serrano",
  "required_journeys": [
    "launch-smoke"
  ],
  "schema_version": "1.0",
  "suite": "smoke",
  "visual_checkpoints": []
}
